{
  "@context": "https://linked.art/ns/v1/linked-art.json",
  "id": "https://linked.art/example/place/4",
  "type": "Place",
  "_label": "True Auction House Location",
  "approximated_by": [
    {
      "type": "Place",
      "_label": "Auction House Location Approximation",
      "defined_by": "POINT(-0.0032937526703165 51.515107154846)"
    }
  ]
}